file_number,message_id,title,author,author_link,author_id
630011,message #1223035,Project Disappears from Project Explorer,Anshuman Chakraborty,index.php?t=usrinfo&id=185042&,185042
630039,message #1223063,Best Practice for teamwork with papyrus,Martin Heinrich,index.php?t=usrinfo&id=181572&,181572
630062,message #1223088,Annotations and white spaces,Plamen Petkov,index.php?t=usrinfo&id=185045&,185045
630097,message #1223124,Can't Open Eclipse,Joe Gibson,index.php?t=usrinfo&id=184855&,184855
630116,message #1223143,Deployment issue from glassfish 4.0 using eclipse plug-in,Madhusaran A,index.php?t=usrinfo&id=185050&,185050
630130,message #1223157,How-to use css to customise ECF views ?,Bernard Sarter,index.php?t=usrinfo&id=123174&,123174
630178,message #1223213,"Access EMF Model from Resources of Deployed plugin- ""Not workspace""",Salwa Alzahmi,index.php?t=usrinfo&id=172843&,172843
630181,message #1223217,"Symbol ""unique_ptr"" could not be resolved.",Jake Horsfield,index.php?t=usrinfo&id=185059&,185059
630242,message #1223281,How to improve the performance of the rap app when many widgets are used?,David Song,index.php?t=usrinfo&id=80713&,80713
630251,message #1223290,Whitespace removal from indented lines,Mike xx,index.php?t=usrinfo&id=178529&,178529
630273,message #1223313,Fixed size table in PDF format,Alex Che,index.php?t=usrinfo&id=185069&,185069
630277,message #1223317,EMF code generator [Error emf.Ecore2Java],javs javs,index.php?t=usrinfo&id=182105&,182105
630287,message #1223327,make column header sticky,Gary Zuo,index.php?t=usrinfo&id=185070&,185070
630314,message #1223354,Problem reading model with SysML 1.3 stereotypes applied,Raphael B,index.php?t=usrinfo&id=169381&,169381
630323,message #1223367,is there Environment variables for 'Builders' when debug/Release build?,Android Dev,index.php?t=usrinfo&id=185077&,185077
630336,message #1223382,Problem Referring to Existing EPackage,Ramu Mothukuru,index.php?t=usrinfo&id=158075&,158075
630370,message #1223428,[XCore] extending XCore,Joel Greenyer,index.php?t=usrinfo&id=27402&,27402
630372,message #1223430,[EMF] [CDO] ConcurrentModificationException when setting setTrackingModification(true),Leonid Ripeynih,index.php?t=usrinfo&id=135650&,135650
630375,message #1223433,locale text on pie chart category series label,José Litux,index.php?t=usrinfo&id=167900&,167900
630391,message #1223451,Need to open browser externally.. getting error,no name no name,index.php?t=usrinfo&id=135679&,135679
630393,message #1223453,[Edapt] visualizing the migration process,Christophe Bouhier,index.php?t=usrinfo&id=61108&,61108
630396,message #1223456,open one browser and one editor in same eclipse workbench,no name no name,index.php?t=usrinfo&id=135679&,135679
630419,message #1223485,Custom security filter calling a scout service,Patrick Mackinlay,index.php?t=usrinfo&id=183862&,183862
630442,message #1223515,change query depending on locale [solved],José Litux,index.php?t=usrinfo&id=167900&,167900
630448,message #1223521,"Birt cannot get data from Postgres's RefCursor, so , How do i do this?",Gaston Flores,index.php?t=usrinfo&id=185100&,185100
630452,message #1223525,Routing tutorial,Filipe Ramos,index.php?t=usrinfo&id=185101&,185101
630463,message #1223536,generate code out of metamodel(.ecore file ) using xpandfacade,Adnan AL-SOSWA,index.php?t=usrinfo&id=84174&,84174
630466,message #1223539,Eclipse and XML,John Steele,index.php?t=usrinfo&id=185092&,185092
630468,message #1223541,How to create a UML!Type entity and access XSD elements inside WSDLfile,michel souza,index.php?t=usrinfo&id=184177&,184177
630479,message #1223552,MongoDB ODA Online Doc Available,Linda Chan,index.php?t=usrinfo&id=15210&,15210
631290,message #1224375,"Latest Luna version for win64, org.eclipse.swt is missing",ModelGeek Mising name,index.php?t=usrinfo&id=116894&,116894
631295,message #1224381,Project not found error,Craig Foote,index.php?t=usrinfo&id=52764&,52764
631297,message #1224383,Using OCLHelper and OCL API... Simple working example !?,Naif Mokhayesh,index.php?t=usrinfo&id=128567&,128567
631305,message #1224391,XsScript debugging in Eclipse,James Lockwood,index.php?t=usrinfo&id=57277&,57277
631310,message #1224397,breakpoint invalid,zhang siwei,index.php?t=usrinfo&id=185184&,185184
631339,message #1224427,"How to,,,,",Walter Mising name,index.php?t=usrinfo&id=48618&,48618
631370,message #1224459,Problems with the source code - need help!,Markus Kuhn,index.php?t=usrinfo&id=179410&,179410
631375,message #1224467,Figure move border,Bartosz Popiela,index.php?t=usrinfo&id=137837&,137837
631401,message #1224493,"[Acceleo] Testing an acceleo project, which depends on another acceleo project",Joe I,index.php?t=usrinfo&id=172036&,172036
631424,message #1224516,lost my .java class file import popup help,Ralph Freshour,index.php?t=usrinfo&id=185201&,185201
631439,message #1224531,How can I change the vertical alignment of a label?,Camilo Alvarez,index.php?t=usrinfo&id=175862&,175862
631457,message #1224549,Eclipse wont start,Justin Kelly,index.php?t=usrinfo&id=185206&,185206
631462,message #1224554,Submenu using IContextMenuEntry,Mithu Deb,index.php?t=usrinfo&id=180057&,180057
631517,message #1224610,"""make"" ""bash"" is not found in PATH",Waqas Majeed,index.php?t=usrinfo&id=185218&,185218
631526,message #1224619,Download pages are not displayed correctly,Jeremie Bresson,index.php?t=usrinfo&id=127041&,127041
631535,message #1224628,Proposal: ToolButtons in a form,Jeremie Bresson,index.php?t=usrinfo&id=127041&,127041
631561,message #1224659,"Hudson Configuration Changes can't be ""Saved""",Melissa Hixenbaugh,index.php?t=usrinfo&id=185232&,185232
631569,message #1224668,enable discoverers' stack-trace / activity-logging,Betto McRose Gamarra,index.php?t=usrinfo&id=34027&,34027
631572,message #1224671,"[EMF Validation] IBatchValidator.validate returns ""No constraints were evaluated.""",Andreas Jakobik,index.php?t=usrinfo&id=128946&,128946
631584,message #1224683,how to set excel column width as content width,suresh kasetti,index.php?t=usrinfo&id=185231&,185231
631608,message #1224708,Eclipse technical question,Stefan Hristow,index.php?t=usrinfo&id=185239&,185239
631617,message #1224717,Eclipselink Extensible Entity throw java.lang.NoSuchFieldException,Barry Zhong,index.php?t=usrinfo&id=167262&,167262
631625,message #1224725,Fatal crash on opening Marketplace in Luna 4.4M4,Craig Foote,index.php?t=usrinfo&id=52764&,52764
631634,message #1224736,How can i select releated nodes when a node selected on Diagram?,serhat gezgin,index.php?t=usrinfo&id=161845&,161845
631642,message #1224748,Toplink 9 to EclipseLink migration issue,Subhadip Chatterjee,index.php?t=usrinfo&id=185247&,185247
631646,message #1224756,How can i get Unassigned Technical Name..?,Rajasekar S,index.php?t=usrinfo&id=184008&,184008
631660,message #1224772,working with org.eclipse.scout.rt.ui.rap.workbench,André Morais,index.php?t=usrinfo&id=184970&,184970
631663,message #1224775,Reading created model,Filipe Ramos,index.php?t=usrinfo&id=185101&,185101
631680,message #1224793,Issue with ColumnReorder and Refresh,Testr t,index.php?t=usrinfo&id=169291&,169291
631701,message #1224818,[Acceleo] Heap Space Problems during Generation,Stefan Häusler,index.php?t=usrinfo&id=172340&,172340
631704,message #1224821,[Solved] Hide expand buttons of file nodes in Project Explorer,Amenel Voglozin,index.php?t=usrinfo&id=75146&,75146
631748,message #1224869,There is a complete version of Eclipse?,Eduardo Luna,index.php?t=usrinfo&id=185257&,185257
631778,message #1224899,"Cannot manage teams: ""You do not have permission to manage teams!""",Joel F,index.php?t=usrinfo&id=130875&,130875
631815,message #1224937,Plugin.xml reload,Don Smyth,index.php?t=usrinfo&id=169782&,169782
631824,message #1224946,Metalua integration with LDT,Paul K,index.php?t=usrinfo&id=185262&,185262
631852,message #1224976,"JPA reuse some ""previous"" JDBC login credentials",Aldo Bariani,index.php?t=usrinfo&id=185266&,185266
631859,message #1224987,Detecting include paths and preprocessor symbols,Shaun Pinney,index.php?t=usrinfo&id=185267&,185267
631881,message #1225012,How to handle overloaded methods with Custome xbase scope provider,Gayan Perera,index.php?t=usrinfo&id=159063&,159063
631944,message #1225079,How to debug pax with Eclipse?,dbkarm dbkarm,index.php?t=usrinfo&id=185275&,185275
631994,message #1225133,Content-assist grammar has warnings while the main one has no,Vincent Simonet,index.php?t=usrinfo&id=152264&,152264
632002,message #1225141,[EMF] XML Serialization sequentially,Benjamin M.,index.php?t=usrinfo&id=151067&,151067
632139,message #1225283,[SOLVED] Single-Table Multitenancy and Cross-Tenant Access,Florian Gessner,index.php?t=usrinfo&id=100027&,100027
632198,message #1225345,How to setup Equinox properly,Ulrich Schmidt,index.php?t=usrinfo&id=92476&,92476
632212,message #1225361,jar in Editor-Plugin,Philip Schledermann,index.php?t=usrinfo&id=185301&,185301
632217,message #1225366,Eclipse (Kepler) MySQL Connector/J location on Mac/OS X,Guy Dillen,index.php?t=usrinfo&id=185302&,185302
632245,message #1225396,Web Deployment Descriptor Disappears,Karl Nicholas,index.php?t=usrinfo&id=183285&,183285
632249,message #1225401,"[MWE2] Running workflow from plugin, custom components not found",Juan Cadavid,index.php?t=usrinfo&id=48119&,48119
632287,message #1225440,Problems with Eclipse Marketplace and Saros,Frank Pasqualini,index.php?t=usrinfo&id=185308&,185308
632309,message #1225463,Presentation Question,Daniel Acki,index.php?t=usrinfo&id=178250&,178250
632311,message #1225465,EGL Native class instantiation,Arseniy Isakov,index.php?t=usrinfo&id=141976&,141976
632359,message #1225515,"Can not reference my own Service (""Unknown service..."")",Michael Lukaszczyk,index.php?t=usrinfo&id=183045&,183045
632397,message #1225555,a problem with wrappers which have parameters,duke vah,index.php?t=usrinfo&id=185000&,185000
632398,message #1225557,Xtext OutputConfigurationProvider,Kunal Khaware,index.php?t=usrinfo&id=185320&,185320
632421,message #1225585,BlackBerry Simulator PIN,Saadillah Akbar,index.php?t=usrinfo&id=185322&,185322
632433,message #1225598,Adding Voting Button in mail,Divya R Dharan,index.php?t=usrinfo&id=116972&,116972
632454,message #1225625,Insert instructions / keyword in DLTK,Fabio Tiozzo,index.php?t=usrinfo&id=185332&,185332
632456,message #1225627,Generation of model files with Maven,Adrian Pollak,index.php?t=usrinfo&id=177852&,177852
632464,message #1225638,Writing the contents of xtext editor to some other view,Arshad Adavani,index.php?t=usrinfo&id=156411&,156411
632469,message #1225643,Birt Report,Nagarajan M,index.php?t=usrinfo&id=185337&,185337
632471,message #1225647,Git plugin: Hudson couldn't parse URI,Konrad Zielinski,index.php?t=usrinfo&id=185324&,185324
632508,message #1225695,EMF.ECORE2JAVA run ant from java,javs javs,index.php?t=usrinfo&id=182105&,182105
632513,message #1225702,Upload FileDialog customization?,Vincenzo Caselli,index.php?t=usrinfo&id=133893&,133893
632519,message #1225713,inconsistent xtext version ranges for binary dependencies during materialization,Lorenzo Bettini,index.php?t=usrinfo&id=31021&,31021
632521,message #1225715,TableViewer programmatic selection binding problem,Joseph Gagnon,index.php?t=usrinfo&id=172756&,172756
632524,message #1225720,"my eclipse not recognized ""include<****.h>"" and Typical variables like ""int&quo",ha d,index.php?t=usrinfo&id=185351&,185351
632533,message #1225732,How to load and parse a language file inside an OSGi bundle,Cristiano Gaviao,index.php?t=usrinfo&id=54407&,54407
632563,message #1225765,Force Top-level Coolbar Layout,Ed Schwarz,index.php?t=usrinfo&id=183293&,183293
632565,message #1225768,Getting Started With Eclipse,Brandon Doering,index.php?t=usrinfo&id=185365&,185365
632579,message #1225784,Hudson migration from HPUX to Linux,babu pusulury,index.php?t=usrinfo&id=185369&,185369
632586,message #1225792,Drag&Drop into an empty MPartStack,Andriy Fomenko,index.php?t=usrinfo&id=171037&,171037
632604,message #1225810,"when scroling horizontally, nattable filter stop working",Mohamed SADI,index.php?t=usrinfo&id=185374&,185374
632619,message #1225825,How does Eclipse load /usr/lib64/IcedTeaPlugin.so ?,B C,index.php?t=usrinfo&id=185372&,185372
632626,message #1225832,UML Class Diagram Editor based on Graphiti,Stephan Krusche,index.php?t=usrinfo&id=92110&,92110
632645,message #1225852,"Eclipse Standard 4.3.1, installable throws an error while trying to extract",Kris B,index.php?t=usrinfo&id=185378&,185378
632668,message #1225876,Version 1.0.1 is now available,Robert Brodt,index.php?t=usrinfo&id=77626&,77626
632674,message #1225883,Diagram extensions behave differently,Michael Lukaszczyk,index.php?t=usrinfo&id=183045&,183045
632686,message #1225895,AWS Toolkit for Eclipse Issue on Mavericks,chase bolton,index.php?t=usrinfo&id=185382&,185382
632738,message #1225950,Map remote build error logs with code using CDT,chandan singh,index.php?t=usrinfo&id=158065&,158065
632748,message #1225963,Open a repository over URL with JGIT,Vicknesh Subramaniyam,index.php?t=usrinfo&id=185390&,185390
632791,message #1226015,Button icon disabled,Victor Lopez,index.php?t=usrinfo&id=178094&,178094
632793,message #1226018,TableViewer programmatic selection binding problem,Joseph Gagnon,index.php?t=usrinfo&id=172756&,172756
632813,message #1226046,Tracepoints ARM Android,joe liccese,index.php?t=usrinfo&id=185398&,185398
632837,message #1226074,[EMFStore] Running EMFStore Client in a web app,Scott Dybiec,index.php?t=usrinfo&id=33362&,33362
632861,message #1226101,ANTLR replacement,Markus Wolf,index.php?t=usrinfo&id=28332&,28332
632889,message #1226130,Double-click to open diagram failing,Nigel Daniels,index.php?t=usrinfo&id=114385&,114385
632898,message #1226139,Install Question,Guy Dillen,index.php?t=usrinfo&id=185302&,185302
632946,message #1226185,Own widget,Martin Bayer,index.php?t=usrinfo&id=158665&,158665
632985,message #1226224,eclipse exit after running project,yeklavya ryan,index.php?t=usrinfo&id=185424&,185424
633022,message #1226261,[CDO] DBStore support for join and async query,Ashish Shinde,index.php?t=usrinfo&id=176860&,176860
633091,message #1226335,Is Javascript Eclipse a different application?,Alejandro Silvestri,index.php?t=usrinfo&id=185430&,185430
633115,message #1226362,[Texo] Table Name Prefix ignored if Entity extends an abstract class,Ralf Heydenreich,index.php?t=usrinfo&id=61949&,61949
633131,message #1226379,How to use a Papyrus UML profile as a DSL in Sirius?,Luís de Sousa,index.php?t=usrinfo&id=43270&,43270
633146,message #1226394,"Brand New, Total Noob, Having Trouble With Install",James Brashear,index.php?t=usrinfo&id=185433&,185433
633190,message #1226440,EGL imports,Arseniy Isakov,index.php?t=usrinfo&id=141976&,141976
633195,message #1226446,"Is the ext. point ""org.eclipse.xtext.ui.shared.sharedStateContributingModule"" public API?",Torsten Juergeleit,index.php?t=usrinfo&id=13756&,13756
633202,message #1226453,How to implement hyperlinking for URI of importURI grammar element?,Torsten Juergeleit,index.php?t=usrinfo&id=13756&,13756
633206,message #1226457,How to stop Eclipse's autocompletion from going mad?,Michael Moser,index.php?t=usrinfo&id=148563&,148563
633228,message #1226482,ATL dynamic creation and referencing,Chris Bailey,index.php?t=usrinfo&id=185434&,185434
633237,message #1226492,Birt vierwer and Birt Taglib bug from different webapp,Cyril Rognon,index.php?t=usrinfo&id=89237&,89237
633264,message #1226523,"Eclipse shows errors in ""Hello World"" Compiler does not",Chris Albertson,index.php?t=usrinfo&id=185436&,185436
633283,message #1226544,Browser update in real-time,Brigham White,index.php?t=usrinfo&id=146806&,146806
633306,message #1226568,debug php file called from html form tag,Brigham White,index.php?t=usrinfo&id=146806&,146806
633323,message #1226585,Refer to OSGI bundles from a WAB project,Arpan Mukhopadhyay,index.php?t=usrinfo&id=185442&,185442
633328,message #1226592,java question?,rafiq tolas,index.php?t=usrinfo&id=185443&,185443
633337,message #1226601,eclipse exit after running project(servelt),yeklavya ryan,index.php?t=usrinfo&id=185424&,185424
633344,message #1226610,xtext validation on tabular inputs,khelan patel,index.php?t=usrinfo&id=185445&,185445
633386,message #1226669,Details on P2 Features Scope,Andreas Weise,index.php?t=usrinfo&id=156388&,156388
633389,message #1226672,How to get the diagram programatically,Epi Liptik,index.php?t=usrinfo&id=183274&,183274
633397,message #1226683,TranslationBundleLoadingException,Daniel Takai,index.php?t=usrinfo&id=185162&,185162
633415,message #1226706,How to compile LUA scripts with Koneki?,Alex Top,index.php?t=usrinfo&id=185459&,185459
633418,message #1226711,How to get tabs instead of spaces (Koneki),Alex Top,index.php?t=usrinfo&id=185459&,185459
633424,message #1226719,How to call other function when user chooses one CompletionProposal,James Li,index.php?t=usrinfo&id=185458&,185458
633426,message #1226722,Limiting LCS in compare,Aniruddha Deshpande,index.php?t=usrinfo&id=185463&,185463
633440,message #1226738,BIRT dataset event handler,narsimha aamudhala,index.php?t=usrinfo&id=185465&,185465
633477,message #1226783,Cannot get Web page editor + some other functionnality do not work,thomas spitz,index.php?t=usrinfo&id=185472&,185472
633483,message #1226789,History for a OneToMany relationship not working,Heidi Hinckley,index.php?t=usrinfo&id=185413&,185413
633485,message #1226792,is git.auto.fetch implemented at all?,Lorenzo Bettini,index.php?t=usrinfo&id=31021&,31021
633491,message #1226798,Problem with new RWT.PRELOADED_ITEMS,Ingo Meyer,index.php?t=usrinfo&id=43745&,43745
633494,message #1226801,Website is down,Eclipse User,/donate,0
633510,message #1226817,Log4j calls,Kalingaraj R,index.php?t=usrinfo&id=185477&,185477
633516,message #1226823,javaw.exe error,Steve Preda,index.php?t=usrinfo&id=185478&,185478
633522,message #1226829,Plz help me [ QVT Relational],javana jab,index.php?t=usrinfo&id=185483&,185483
633526,message #1226833,FX Projects Types,Chuck Davis,index.php?t=usrinfo&id=185484&,185484
633535,message #1226843,[CDO] Minor patches for 4.3,Alain Picard,index.php?t=usrinfo&id=28071&,28071
633558,message #1226868,Radio Buttons not visible,Vincenzo Caselli,index.php?t=usrinfo&id=133893&,133893
633567,message #1226878,Ecore defaultValue for EByteArray or EFloat with multiplicities,Klaus Meiner,index.php?t=usrinfo&id=185493&,185493
633640,message #1226953,CallBack Object creation in Host plugin,Harikrishna M,index.php?t=usrinfo&id=177279&,177279
633645,message #1226958,Dynamically language change while generating Birt Report,sudhakar Mising name,index.php?t=usrinfo&id=118970&,118970
633651,message #1226964,How to set remote system for remote debug,json nicolas,index.php?t=usrinfo&id=185503&,185503
633653,message #1226966,Xtext content assist,Kunal Khaware,index.php?t=usrinfo&id=185320&,185320
633657,message #1226970,Rollink back the upstream master,Ed Willink,index.php?t=usrinfo&id=8586&,8586
633663,message #1226978,How does birt use the datasource in applicationContext.xml?,Beryl Yellow,index.php?t=usrinfo&id=174664&,174664
633670,message #1226989,Code Recommenders build errors - Extenders,Aman Singh,index.php?t=usrinfo&id=147048&,147048
633673,message #1226993,User preferences implementation,Patrick Mackinlay,index.php?t=usrinfo&id=183862&,183862
633678,message #1226998,Service reference life cycle,Patrick Mackinlay,index.php?t=usrinfo&id=183862&,183862
633682,message #1227002,[CDO] Ecore lazy-loading,Przemko Robakowski,index.php?t=usrinfo&id=185510&,185510
633685,message #1227006,Birt report - own buttons for refresh,srinu vadapalli,index.php?t=usrinfo&id=184037&,184037
633701,message #1227030,E4 BindingTable priority,Sebastien Pennec,index.php?t=usrinfo&id=76508&,76508
633708,message #1227039,How to update the default Report Parameter value,Bud Elias,index.php?t=usrinfo&id=185521&,185521
633717,message #1227049,Problem using DOCX4J for word conversion to PDF,Dominic Hanlan,index.php?t=usrinfo&id=44455&,44455
633719,message #1227052,[BIRT 4.3.1] Dataset does not close idle connections,vinc thau,index.php?t=usrinfo&id=185524&,185524
633720,message #1227053,H2 with EclipseLink,Andriy L,index.php?t=usrinfo&id=185525&,185525
633731,message #1227065,"Reading the dataset ""Max number of rows fetched from datasource"" value from system propert",S peethala,index.php?t=usrinfo&id=184989&,184989
633744,message #1227080,ROOT Directory,farid dre,index.php?t=usrinfo&id=185532&,185532
633759,message #1227097,Any plan for 2.2 Feature Version in Kepler Update Site?,Tom Tan,index.php?t=usrinfo&id=140796&,140796
633761,message #1227099,Rename package programmatically,Rick Crawford,index.php?t=usrinfo&id=185540&,185540
633763,message #1227102,Import and content assist,Jeff MAURY,index.php?t=usrinfo&id=31680&,31680
633768,message #1227108,getSite() returns null,romain ognier,index.php?t=usrinfo&id=178766&,178766
633773,message #1227114,Install Maven plugin via command prompt,Mike Liedike,index.php?t=usrinfo&id=185543&,185543
633781,message #1227124,Include paths and Kepler (on Windows),Juha Aaltonen,index.php?t=usrinfo&id=185545&,185545
633783,message #1227126,Dynamically sum column-data total in tables onPrepare event,nari noori,index.php?t=usrinfo&id=158399&,158399
633785,message #1227129,"Kepler, Gnu ARM toolchain and OpenOCD",Juha Aaltonen,index.php?t=usrinfo&id=185545&,185545
633801,message #1227149,Is it possible to sort data prior to computing columns?,Sebi F,index.php?t=usrinfo&id=185552&,185552
633817,message #1227168,Hudson svn-tag plug-in 1.16 throwing exception,Perry Pollock,index.php?t=usrinfo&id=185557&,185557
633830,message #1227183,Open Diagram programmatically,Camilo Alvarez,index.php?t=usrinfo&id=175862&,175862
633866,message #1227223,Class of ParameterizedType,Steven Elliott,index.php?t=usrinfo&id=173902&,173902
633869,message #1227226,SWTBot with Tycho in Travis CI,Satyagraha 1956,index.php?t=usrinfo&id=74980&,74980
633871,message #1227228,Shared Primary Key examples?,Deanna D,index.php?t=usrinfo&id=185566&,185566
633873,message #1227230,Failed to build the e(fx)clipse Tutorial 5.,Stefan Hennig,index.php?t=usrinfo&id=133775&,133775
633884,message #1227242,virgo servie with  Apache Daemon (prunsrv.exe),Gary Zharzhavsky,index.php?t=usrinfo&id=185190&,185190
633893,message #1227252,slf4j problem with Eclipse Luna,Rolf Schumacher,index.php?t=usrinfo&id=185572&,185572
633897,message #1227256,Change user/pwd on EntityManager in J2EE for auditing,gregory arrowood,index.php?t=usrinfo&id=185570&,185570
633923,message #1227282,how to open existing tutorial of j2ee example in eclispe,P Trinh,index.php?t=usrinfo&id=185576&,185576
633940,message #1227299,EGL and User defined operation,Arseniy Isakov,index.php?t=usrinfo&id=141976&,141976
633996,message #1227361,Undo feature does not work.,Fischer L,index.php?t=usrinfo&id=185588&,185588
634039,message #1227410,Unable to find source files when connecting to a GDB server,Pierre Andersson,index.php?t=usrinfo&id=185595&,185595
634047,message #1227422,When to fire widget events?,Thomas Kratz,index.php?t=usrinfo&id=39125&,39125
634055,message #1227430,[CDO] loading resources and package registration.,Christophe Bouhier,index.php?t=usrinfo&id=61108&,61108
634109,message #1227491,Re: [CDO] Open Resource Dialog,Eike Stepper,index.php?t=usrinfo&id=10003&,10003
634116,message #1227502,update conflicts,David M. Karr,index.php?t=usrinfo&id=58746&,58746
634122,message #1227508,Building a cross-compile library (compile but not link?),Matthew Mucker,index.php?t=usrinfo&id=185602&,185602
634172,message #1227563,Binding for List of Strings,Andreas Weise,index.php?t=usrinfo&id=156388&,156388
634239,message #1227631,External .jar + git repo,Justin Willis,index.php?t=usrinfo&id=185616&,185616
634256,message #1227648,Eclipse for website developers,Andy Mcclay,index.php?t=usrinfo&id=185617&,185617
634296,message #1227691,How do you pass parameters to the factory method of a custom widget,Martin Tauber,index.php?t=usrinfo&id=35824&,35824
634297,message #1227692,Platform.getExtensionRegistry is null,Martin Tauber,index.php?t=usrinfo&id=35824&,35824
634307,message #1227703,Label on @PossibleValues,Andreas Weise,index.php?t=usrinfo&id=156388&,156388
634313,message #1227709,Android Project - Emulator & Real Device Not Working,Rene Ace,index.php?t=usrinfo&id=185620&,185620
634317,message #1227713,Adding UI Elements at runtime,Phi Fa,index.php?t=usrinfo&id=184049&,184049
634330,message #1227726,Remote development C++,Dima Dima,index.php?t=usrinfo&id=185622&,185622
634337,message #1227735,Branding,Walter Mising name,index.php?t=usrinfo&id=48618&,48618
634357,message #1227757,How To,Walter Mising name,index.php?t=usrinfo&id=48618&,48618
634472,message #1227884,Acces items created in XML in widget using RemoteViews,Nando Flores,index.php?t=usrinfo&id=180008&,180008
634524,message #1227939,Count commit to SVN plugin,Hoang Duc,index.php?t=usrinfo&id=184648&,184648
634555,message #1227972,Eclipse for EGL,Jie Gao,index.php?t=usrinfo&id=181493&,181493
634558,message #1227975,System Requirements for eclipse (java),Bob Andrew Bergh,index.php?t=usrinfo&id=185649&,185649
634567,message #1227988,Slide pages control by finger,onemega kayali,index.php?t=usrinfo&id=185650&,185650
634578,message #1228001,Teneo: Issue with multiple sessions,Chandre Gowda,index.php?t=usrinfo&id=170301&,170301
634580,message #1228004,Teneo: Issue with Merge(),Chandre Gowda,index.php?t=usrinfo&id=170301&,170301
634585,message #1228009,Could not create Eclipse 4 Project,Andreas Grund,index.php?t=usrinfo&id=100351&,100351
634598,message #1228028,Build Tool for RCP,S. Schulz,index.php?t=usrinfo&id=126397&,126397
634599,message #1228030,Cross references not getting resolved on Clean Build,Arshad Adavani,index.php?t=usrinfo&id=156411&,156411
634600,message #1228031,Build Tool for RAP,S. Schulz,index.php?t=usrinfo&id=126397&,126397
